{
  "schema_version": "1.0.0",
  "catalog_version": "1.0.0",
  "policy": {
    "max_attempts_per_image": 3,
    "width": 1200,
    "height": 630,
    "allowed_formats": ["webp", "png"]
  },
  "images": [
    {
      "story_id": "agent-skill-1",
      "image_id": "img-agent-skill-workflow",
      "binary_seed": "agent-skill-workflow-v1",
      "format": "webp",
      "width": 1200,
      "height": 630,
      "composition_id": "layered-skill-package",
      "mechanism_summary": "A reusable skill package binds instructions, tool steps, verification gates, and repeatable outputs into one reusable agent procedure.",
      "professional_textbook_editorial": true,
      "story_specific": true,
      "mechanism_explanatory": true,
      "high_detail": true,
      "high_information_density": true,
      "white_background": true,
      "sparse_generic_box_arrow": false,
      "reused_composition": false,
      "photo": false,
      "people": false,
      "decorative_collage": false,
      "clipped_text": false,
      "overlapping_text": false
    },
    {
      "story_id": "agent-general-1",
      "image_id": "img-agent-approval-checkpoints",
      "binary_seed": "agent-approval-checkpoints-v1",
      "format": "webp",
      "width": 1200,
      "height": 630,
      "composition_id": "approval-gated-agent-loop",
      "mechanism_summary": "An agent execution loop pauses at consequential action boundaries, routes proposed actions through approval gates, and resumes only after an explicit decision.",
      "professional_textbook_editorial": true,
      "story_specific": true,
      "mechanism_explanatory": true,
      "high_detail": true,
      "high_information_density": true,
      "white_background": true,
      "sparse_generic_box_arrow": false,
      "reused_composition": false,
      "photo": false,
      "people": false,
      "decorative_collage": false,
      "clipped_text": false,
      "overlapping_text": false
    },
    {
      "story_id": "applied-workflow-1",
      "image_id": "img-grounded-source-notes",
      "binary_seed": "grounded-source-notes-v1",
      "format": "webp",
      "width": 1200,
      "height": 630,
      "composition_id": "claim-note-evidence-lattice",
      "mechanism_summary": "Generated work remains linked to source notes through claim-level references so reviewers can trace assertions back to evidence.",
      "professional_textbook_editorial": true,
      "story_specific": true,
      "mechanism_explanatory": true,
      "high_detail": true,
      "high_information_density": true,
      "white_background": true,
      "sparse_generic_box_arrow": false,
      "reused_composition": false,
      "photo": false,
      "people": false,
      "decorative_collage": false,
      "clipped_text": false,
      "overlapping_text": false,
      "accept_on_attempt": 2
    },
    {
      "story_id": "applied-context-2",
      "image_id": "img-context-separation",
      "binary_seed": "context-separation-v1",
      "format": "webp",
      "width": 1200,
      "height": 630,
      "composition_id": "durable-transient-context-stack",
      "mechanism_summary": "Durable operating instructions are separated from temporary task context and combined only at execution time to reduce recurring prompt drift.",
      "professional_textbook_editorial": true,
      "story_specific": true,
      "mechanism_explanatory": true,
      "high_detail": true,
      "high_information_density": true,
      "white_background": true,
      "sparse_generic_box_arrow": false,
      "reused_composition": false,
      "photo": false,
      "people": false,
      "decorative_collage": false,
      "clipped_text": false,
      "overlapping_text": false
    },
    {
      "story_id": "technical-grounding-1",
      "image_id": "img-claim-provenance",
      "binary_seed": "claim-provenance-v1",
      "format": "webp",
      "width": 1200,
      "height": 630,
      "composition_id": "claim-provenance-graph",
      "mechanism_summary": "A grounding pipeline decomposes generated output into claims and binds each claim to its supporting evidence and provenance record.",
      "professional_textbook_editorial": true,
      "story_specific": true,
      "mechanism_explanatory": true,
      "high_detail": true,
      "high_information_density": true,
      "white_background": true,
      "sparse_generic_box_arrow": false,
      "reused_composition": false,
      "photo": false,
      "people": false,
      "decorative_collage": false,
      "clipped_text": false,
      "overlapping_text": false
    },
    {
      "story_id": "technical-evals-1",
      "image_id": "img-tool-failure-isolation",
      "binary_seed": "tool-failure-isolation-v1",
      "format": "webp",
      "width": 1200,
      "height": 630,
      "composition_id": "failure-isolation-matrix",
      "mechanism_summary": "An evaluation harness separates tool-call failures, model-output failures, and evidence failures so repair can target the failing boundary.",
      "professional_textbook_editorial": true,
      "story_specific": true,
      "mechanism_explanatory": true,
      "high_detail": true,
      "high_information_density": true,
      "white_background": true,
      "sparse_generic_box_arrow": false,
      "reused_composition": false,
      "photo": false,
      "people": false,
      "decorative_collage": false,
      "clipped_text": false,
      "overlapping_text": false
    }
  ]
}
